{
  "schema_version": 1,
  "environment": "current desktop + isolated fixture; task 1 uses a dedicated disposable QA profile with one user scan; task 5 reuses an existing Playwright profile; task 8 and remaining provider/final-publish boundaries remain unresolved",
  "evidence_status": "complete_with_boundary",
  "tasks": [
    {"task_id": 1, "name": "首次连接抖音并扫码", "status": "passed", "evidence_ref": "docs/reviews/application-publishing-program/qa/COORD-0-first-scan-passed-2026-07-19.json", "metrics_ref": "docs/reviews/application-publishing-program/qa/COORD-0-pub-a-nine-task-metrics-2026-07-19.json", "click_count": 0, "automation_ms": 13118, "human_wait_ms": 32283, "notes": "隔离 QA profile 一次扫码通过；automation 为扫码后验证/重开区间，human_wait 为已观测扫码等待窗口；未上传或发布"},
    {"task_id": 2, "name": "关闭浏览器、重开账号", "status": "passed", "evidence_ref": "docs/reviews/application-publishing-program/COORD-0-douyin-playwright-reopen-2026-07-19.md", "metrics_ref": "docs/reviews/application-publishing-program/qa/COORD-0-pub-a-nine-task-metrics-2026-07-19.json", "click_count": 0, "automation_ms": 13006, "human_wait_ms": 0, "notes": "复用既有 profile 的关闭/重开事件链；无页面点击、无人工等待"},
    {"task_id": 3, "name": "重启应用、验证免扫码", "status": "passed", "evidence_ref": "docs/reviews/application-publishing-program/COORD-0-tauri-sidecar-restart-2026-07-19.md", "metrics_ref": "docs/reviews/application-publishing-program/qa/COORD-0-pub-a-nine-task-metrics-2026-07-19.json", "click_count": 0, "automation_ms": 84092, "human_wait_ms": 0, "notes": "两轮 Tauri 与两轮 sidecar 生命周期总自动化时长；重启后只读登录探针通过"},
    {"task_id": 4, "name": "无效 MP4 上传", "status": "passed", "evidence_ref": "docs/reviews/application-publishing-program/qa/COORD-0-invalid-media-preflight-2026-07-19.json", "metrics_ref": "docs/reviews/application-publishing-program/qa/COORD-0-pub-a-nine-task-metrics-2026-07-19.json", "click_count": 0, "automation_ms": 545, "human_wait_ms": 0, "notes": "一次隔离本地生成+ffprobe 预检；无浏览器动作，不向平台提交坏文件"},
    {"task_id": 5, "name": "有效 MP4 进入编辑器", "status": "passed", "evidence_ref": "docs/reviews/application-publishing-program/COORD-0-douyin-playwright-upload-2026-07-19.md", "metrics_ref": "docs/reviews/application-publishing-program/qa/COORD-0-pub-a-nine-task-metrics-2026-07-19.json", "click_count": 0, "automation_ms": 8922, "human_wait_ms": 0, "notes": "复用已归档任务 8 运行的上传页→编辑器区间；set_input_files 不计为 UI click"},
    {"task_id": 6, "name": "标题、描述和话题填写", "status": "passed", "evidence_ref": "docs/reviews/application-publishing-program/COORD-0-douyin-fields-cover-live-2026-07-19.md", "metrics_ref": "docs/reviews/application-publishing-program/qa/COORD-0-pub-a-nine-task-metrics-2026-07-19.json", "click_count": 0, "automation_ms": 6608, "human_wait_ms": 0, "notes": "真实标题/描述/话题回填与预览；DOM fill 无页面 click"},
    {"task_id": 7, "name": "封面上传、裁切弹窗和保存", "status": "passed", "evidence_ref": "docs/reviews/application-publishing-program/COORD-0-douyin-fields-cover-live-2026-07-19.md", "metrics_ref": "docs/reviews/application-publishing-program/qa/COORD-0-pub-a-nine-task-metrics-2026-07-19.json", "click_count": 1, "automation_ms": 2536, "human_wait_ms": 0, "notes": "合规竖封面进入裁切弹窗并点击唯一可见保存；横版建议不作为本阶段硬阻塞"},
    {"task_id": 8, "name": "中途关闭窗口后恢复", "status": "failed", "evidence_ref": "docs/reviews/application-publishing-program/qa/COORD-0-task8-recovery-handoff-2026-07-19.json", "metrics_ref": "docs/reviews/application-publishing-program/qa/COORD-0-pub-a-nine-task-metrics-2026-07-19.json", "click_count": 0, "automation_ms": 18129, "human_wait_ms": 0, "notes": "单次关闭/重开真实结果：回到 /content/upload；失败作为当前基线记录，恢复状态机交 PUB-2，不在 COORD-0 重试"},
    {"task_id": 9, "name": "最终停在人工发布前", "status": "passed", "evidence_ref": "docs/reviews/application-publishing-program/COORD-0-douyin-fields-cover-live-2026-07-19.md", "metrics_ref": "docs/reviews/application-publishing-program/qa/COORD-0-pub-a-nine-task-metrics-2026-07-19.json", "click_count": 0, "automation_ms": 2437, "human_wait_ms": 0, "notes": "仅停在发布前；最终发布按钮未点击；live Guard 仍需后续 PUB-3/PUB-5 验证"}
  ]
}
